text,emotion
"Looking back, I am absolutely seething at what my neighbor just did. I'll figure it out.",Anger
No one told me but The way the doctor handled the outcome was completely unacceptable. I'll figure it out.,Anger
I just realized I slammed the door so hard when the doctor said that ridiculous thing. I don't know what to do.,Anger
"At this point, I've been crying all day thinking about the situation. I don't know what to do.",Sad
Not okay. I'm mad.,Anger
I feel so helpless.,Sad
I feel so lucky to experience this kind of happiness right now. I'm still processing everything.,Happy
"Thinking about it now, my coworker made me laugh so hard today, I love spending time together.",Happy
I always knew that I shared the good news with my father and we celebrated together. I'm still processing everything.,Happy
"I can't stop the tears whenever I think about the interview. Life goes on, I suppose.",Sad
"I need to vent — Life feels so beautiful and full of possibilities right now. Life goes on, I suppose.",Happy
"Looking back, she never listens and it drives me absolutely insane. Just needed to share this.",Anger
"At this point, I yelled because I couldn't contain my frustration anymore. I'll figure it out.",Anger
"I need to vent — I feel so alive and energized, everything feels right in the world.",Happy
I am not angry at all.,Normal
I am ecstatic.,Happy
My eyes are swollen from all the crying I've done this week. It's just too much.,Sad
I feel alive.,Happy
I am overjoyed.,Happy
I updated my schedule and moved a few tasks around. I needed to get that off my chest.,Normal
I'm beaming with pride over what I accomplished with the outcome. I needed to get that off my chest.,Happy
"Somehow, I read a book for a bit before going to bed last night. I don't know what to do.",Normal
I feel so alone.,Sad
Everything is falling into place and I couldn't be more grateful. Just needed to share this.,Happy
"Stop it, I'm angry.",Anger
"Somehow, This is absolutely unacceptable, I'm so furious right now.",Anger
"Honestly, I'm so happy I feel like I could burst, this is incredible! It is what it is.",Happy
I keep grinning to myself thinking about how well the decision went.,Happy
I miss the way things used to be before all of this happened.,Sad
"Right now, I took the usual route to the project this morning. And that's just how it is.",Normal
"Thinking about it now, I finished my work for the day and had some dinner.",Normal
I am not unhappy.,Happy
"Looking back, Today marks the happiest day of my life because of the office. It is what it is.",Happy
"To be honest, I feel so alive and energized, everything feels right in the world. It's just too much.",Happy
I feel so lucky to experience this kind of happiness right now.,Happy
I need to vent — The unexpected kindness from my sister made my entire week. I'll figure it out.,Happy
I feel positive.,Happy
I'm done tolerating this kind of behavior from my teacher. I'm still processing everything.,Anger
"At this point, I danced around the room when I heard the amazing news. It is what it is.",Happy
"I have to say, I yelled because I couldn't contain my frustration anymore. I'll figure it out.",Anger
I am alright.,Normal
I am so done.,Anger
No one told me but I yelled because I couldn't contain my frustration anymore.,Anger
"Thinking about it now, The weather was pretty average today, not too hot or cold. I don't know what to do.",Normal
"The weather was pretty average today, not too hot or cold.",Normal
I always knew that my supervisor called me this afternoon and we talked for a while. It's just too much.,Normal
"Right now, The project at the outcome is moving along at a steady pace. Life goes on, I suppose.",Normal
"To be honest, Everything reminds me of my boss and the pain comes flooding back.",Sad
"Thinking about it now, Everything is falling into place and I couldn't be more grateful. Life goes on, I suppose.",Happy
Nothing feels the same since the presentation occurred.,Sad
"No one told me but I can't believe the manager did that to me, it's completely terrible!",Anger
"Looking back, I made a list of things I need to get done this week. I'll figure it out.",Normal
I feel neither sad nor happy.,Normal
"I have to say, Nothing feels the same since the trip occurred. I needed to get that off my chest.",Sad
Nothing feels the same since the event occurred. I don't know what to do.,Sad
"Right now, I replied to some messages and scheduled a few meetings. I'm still processing everything.",Normal
I am just here.,Normal
I feel blessed.,Happy
I am sorrowful.,Sad
I feel so sad today.,Sad
"Right now, The weather was pretty average today, not too hot or cold. I don't know what to do.",Normal
I am completely balanced.,Normal
"To be honest, I reviewed some documents and provided my standard feedback. I don't know what to do.",Normal
"At this point, Why does my boss always find a way to ruin everything? Just needed to share this.",Anger
I need to vent — the competition turned out even better than I ever imagined it would. It is what it is.,Happy
I am as usual.,Normal
I am extremely sad.,Sad
I am just here.,Normal
"Right now, Losing she has left a hole in my heart that won't heal. I needed to get that off my chest.",Sad
I've been grieving this loss for weeks and it hasn't gotten easier.,Sad
No one told me but Nothing feels the same since the interview occurred.,Sad
"Honestly, I'm so frustrated with the competition, it makes my blood boil. I'll figure it out.",Anger
"I always knew that I can't believe my mother did that to me, it's completely outrageous! Just needed to share this.",Anger
"I have to say, I'm so angry I can barely think straight right now. I don't know what to do.",Anger
"To be honest, I am absolutely seething at what the doctor just did. And that's just how it is.",Anger
"Thinking about it now, I feel like a part of me died when the situation happened. It's just too much.",Sad
"To be honest, my teammate mentioned they might drop by later this week. I needed to get that off my chest.",Normal
I am not cheerful.,Sad
I feel so-so.,Normal
I just realized My patience has completely run out with this the outcome. I'm still processing everything.,Anger
"To be honest, I feel content and at peace with where my life is right now. It is what it is.",Happy
I need to vent — I feel so grateful and blessed to have my mother in my life.,Happy
I always knew that My heart aches deeply and I don't know how to stop the pain. I needed to get that off my chest.,Sad
I feel normal.,Normal
I am blue today.,Sad
"At this point, The weather was pretty average today, not too hot or cold. It is what it is.",Normal
I'm so mad I haven't been able to sleep thinking about the deadline. It's just too much.,Anger
"Looking back, I updated my schedule and moved a few tasks around. It's just too much.",Normal
"There wasn't much happening today, just the usual routine. It's just too much.",Normal
No one told me but We had a standard team meeting to go over the week's tasks. It is what it is.,Normal
"Honestly, My heart is full of joy after what happened with work. I'll figure it out.",Happy
"I always knew that my roommate really crossed the line this time, I'm livid. Life goes on, I suppose.",Anger
"Looking back, I feel so empty and hollow inside after what happened.",Sad
"To be honest, The joy I feel from the situation is something I'll never forget. Just needed to share this.",Happy
"Looking back, I updated my schedule and moved a few tasks around. Just needed to share this.",Normal
I am very angry.,Anger
I am not cheerful.,Sad
I don't feel okay.,Sad
"Looking back, I've been crying all day thinking about the presentation. I don't know what to do.",Sad
"No one told me but I shared the good news with my sister and we celebrated together. Life goes on, I suppose.",Happy
"my father told me they love me and I felt like I was floating. Life goes on, I suppose.",Happy
I need to vent — I'm so angry I can barely think straight right now. I'll figure it out.,Anger
"I just realized Every time I think about what happened, I get even more angry. Life goes on, I suppose.",Anger
my teammate told me they love me and I felt like I was floating.,Happy
"At this point, I'm beaming with pride over what I accomplished with the proposal. Just needed to share this.",Happy
"I have to say, There wasn't much happening today, just the usual routine. Life goes on, I suppose.",Normal
I spent the afternoon organizing some files on my computer.,Normal
Why am I so happy today?,Happy
I am not excited.,Normal
I can't stand this.,Anger
"I have to say, I feel so alive and energized, everything feels right in the world. It's just too much.",Happy
I just realized We had a standard team meeting to go over the week's tasks. I needed to get that off my chest.,Normal
I always knew that My patience has completely run out with this the situation. And that's just how it is.,Anger
"Thinking about it now, The day was uneventful but productive enough overall. I'll figure it out.",Normal
"Somehow, I cried myself to sleep again last night because of the deadline. Life goes on, I suppose.",Sad
"Somehow, I feel so alive and energized, everything feels right in the world. I'm still processing everything.",Happy
No one told me but I feel hopeless and don't know how things will ever get better. I'll figure it out.,Sad
The grief I feel from the outcome is overwhelming me. I'm still processing everything.,Sad
"I have to say, I am absolutely seething at what my sister just did. I don't know what to do.",Anger
I always knew that I keep grinning to myself thinking about how well the conference went. I'll figure it out.,Happy
"Looking back, I made a list of things I need to get done this week. Just needed to share this.",Normal
"To be honest, The world feels grey and meaningless since the outcome. I needed to get that off my chest.",Sad
I am doing just fine.,Normal
"Thinking about it now, I prepared a simple meal and watched some television. I needed to get that off my chest.",Normal
I am upbeat.,Happy
Rage is all I feel.,Anger
Why does today feel so ordinary?,Normal
No one told me but I can't forgive she for what they did to work. I'm still processing everything.,Anger
I am deeply heartbroken.,Sad
"Thinking about it now, I danced around the room when I heard the amazing news. I'll figure it out.",Happy
"To be honest, Today was such a wonderful day, everything went perfectly. Life goes on, I suppose.",Happy
"I have to say, The world feels grey and meaningless since school. Life goes on, I suppose.",Sad
"I'm so frustrated with the decision, it makes my blood boil.",Anger
"I have to say, The loneliness after the event is something I wasn't prepared for. And that's just how it is.",Sad
"To be honest, I went for a walk in the evening to clear my head a bit. It's just too much.",Normal
"Looking back, my sister mentioned they might drop by later this week.",Normal
"I have to say, I updated my schedule and moved a few tasks around. It's just too much.",Normal
I am furious.,Anger
"To be honest, my father surprised me today and I couldn't stop smiling all day.",Happy
I always knew that This the event has pushed me past my breaking point. And that's just how it is.,Anger
"Right now, Nothing feels the same since work occurred. And that's just how it is.",Sad
I always knew that Seeing my father's belongings just makes the sadness worse. It is what it is.,Sad
"Somehow, That meeting was a complete waste of time, I'm so irritated. Life goes on, I suppose.",Anger
No one told me but I am absolutely seething at what my boss just did.,Anger
I laughed until my stomach hurt with the doctor today.,Happy
the trip turned out even better than I ever imagined it would.,Happy
"Honestly, Nothing out of the ordinary happened today, just regular tasks. Just needed to share this.",Normal
Why does everything feel hopeless?,Sad
"Honestly, Today marks the happiest day of my life because of the results. I'll figure it out.",Happy
"Somehow, I went for a walk in the evening to clear my head a bit. I'll figure it out.",Normal
I always knew that Thinking about the event fills me with an indescribable sadness. I'll figure it out.,Sad
"Honestly, I slammed the door so hard when my supervisor said that ridiculous thing. Just needed to share this.",Anger
"I always knew that Getting the trip was a dream come true, I'm overjoyed. And that's just how it is.",Happy
No one told me but I threw the papers across the room when I heard the news.,Anger
"I have to say, I took the usual route to the event this morning. I needed to get that off my chest.",Normal
"At this point, I finished my work for the day and had some dinner. It is what it is.",Normal
Why do I feel so empty?,Sad
I am seething.,Anger
"At this point, I keep reaching for my phone to call my teacher and then remember. I'll figure it out.",Sad
"To be honest, The project at the decision is moving along at a steady pace.",Normal
"Honestly, I hugged my brother tight and felt so much love and warmth. I needed to get that off my chest.",Happy
I just realized The commute was about the same as usual today. Just needed to share this.,Normal
I am catastrophically sad.,Sad
My heart aches deeply and I don't know how to stop the pain.,Sad
I always knew that The joy I feel from the situation is something I'll never forget. I needed to get that off my chest.,Happy
I talked briefly with my father about the upcoming plans. I don't know what to do.,Normal
I reminded my father about the appointment scheduled for Friday. I'm still processing everything.,Normal
I always knew that the results turned out even better than I ever imagined it would. It's just too much.,Happy
I always knew that I am absolutely seething at what my roommate just did. Just needed to share this.,Anger
"Thinking about it now, I talked briefly with my brother about the upcoming plans. Just needed to share this.",Normal
I am feeling like myself.,Normal
"Thinking about it now, I can't forgive my roommate for what they did to school. It is what it is.",Anger
I always knew that The way he handled the deadline was completely unacceptable.,Anger
"Honestly, my sister told me they love me and I felt like I was floating. It is what it is.",Happy
"No one told me but I feel utterly alone and abandoned by everyone around me. Life goes on, I suppose.",Sad
The injustice of this the game makes me want to scream. It is what it is.,Anger
"I just realized The weather was pretty average today, not too hot or cold. I'll figure it out.",Normal
No one told me but This whole the situation is a disaster and I'm absolutely fuming.,Anger
I always knew that the manager never listens and it drives me absolutely insane. And that's just how it is.,Anger
I am sad.,Sad
"Thinking about it now, Life feels so beautiful and full of possibilities right now. I'm still processing everything.",Happy
"At this point, Life feels so beautiful and full of possibilities right now. I'm still processing everything.",Happy
Thinking about the meeting fills me with an indescribable sadness. I don't know what to do.,Sad
I am not okay.,Sad
the competition turned out even better than I ever imagined it would. It's just too much.,Happy
I need to vent — I'm done tolerating this kind of behavior from she. I'm still processing everything.,Anger
"I have to say, I replied to some messages and scheduled a few meetings. I don't know what to do.",Normal
I feel content and at peace with where my life is right now. It is what it is.,Happy
I slammed the door so hard when my teammate said that ridiculous thing. It is what it is.,Anger
"Looking back, I yelled because I couldn't contain my frustration anymore. I don't know what to do.",Anger
"Somehow, Losing my colleague has left a hole in my heart that won't heal. I don't know what to do.",Sad
"To be honest, The grief I feel from the process is overwhelming me. I needed to get that off my chest.",Sad
"I just realized I feel content and at peace with where my life is right now. Life goes on, I suppose.",Happy
No one told me but I checked in with my father and everything seems to be in order. I'll figure it out.,Normal
"I have to say, I've been crying all day thinking about the proposal. Life goes on, I suppose.",Sad
I just realized I read a book for a bit before going to bed last night. And that's just how it is.,Normal
"I have to say, Nothing feels the same since the office occurred. I needed to get that off my chest.",Sad
"To be honest, This the process has pushed me past my breaking point. I'll figure it out.",Anger
I always knew that my supervisor was my whole world and now I don't know who I am.,Sad
"Right now, I just sat in the dark, too sad to move or do anything.",Sad
I just realized I don't feel like eating or talking to anyone right now. I don't know what to do.,Sad
I am beyond furious.,Anger
Nothing feels the same since the game occurred.,Sad
"To be honest, I can't forgive my partner for what they did to the competition. And that's just how it is.",Anger
I feel hollow.,Sad
"I'm absolutely thrilled about the game, it's the best news ever! Life goes on, I suppose.",Happy
"Honestly, The injustice of this the project makes me want to scream.",Anger
"Right now, I yelled because I couldn't contain my frustration anymore. And that's just how it is.",Anger
"Right now, I made a list of things I need to get done this week. I'll figure it out.",Normal
"Waking up this morning I felt pure joy for the first time in ages. Life goes on, I suppose.",Happy
"The smile on my face hasn't faded since the interview happened. Life goes on, I suppose.",Happy
"At this point, The smile on my face hasn't faded since the competition happened. It is what it is.",Happy
I cried myself to sleep again last night because of the outcome. And that's just how it is.,Sad
I read a book for a bit before going to bed last night. And that's just how it is.,Normal
I am grieving.,Sad
"I have to say, There wasn't much happening today, just the usual routine.",Normal
Why do I feel so joyful?,Happy
"Somehow, The day was uneventful but productive enough overall. I'll figure it out.",Normal
"Honestly, We had a standard team meeting to go over the week's tasks.",Normal
I feel hopeless.,Sad
I am just doing my thing.,Normal
I am as usual.,Normal
"I have to say, I've been crying all day thinking about the process.",Sad
No one told me but The silence in the house since work is unbearable. I'm still processing everything.,Sad
"To be honest, That meeting was a complete waste of time, I'm so irritated.",Anger
I am full of rage.,Anger
"I have to say, Life feels so beautiful and full of possibilities right now. I needed to get that off my chest.",Happy
The sheer nerve of my roommate to do that after everything I've done. Just needed to share this.,Anger
"Honestly, I went to the store today to pick up a few things we needed. Life goes on, I suppose.",Normal
I need to vent — I feel like I'm drowning in sorrow and can't find the surface.,Sad
"Right now, The grief I feel from the interview is overwhelming me. I'll figure it out.",Sad
I am not doing well.,Sad
"Right now, My patience has completely run out with this the project. Just needed to share this.",Anger
"Right now, That meeting was a complete waste of time, I'm so irritated. It's just too much.",Anger
I am not smiling.,Sad
I am grateful and happy.,Happy
I am visibly angry.,Anger
"Somehow, I want to bottle this feeling and keep it with me forever. And that's just how it is.",Happy
I just realized The afternoon was quiet and I got some reading done. I'll figure it out.,Normal
"That meeting was a complete waste of time, I'm so irritated.",Anger
"Honestly, I woke up at my usual time and started the day normally. Life goes on, I suppose.",Normal
"I have to say, The sheer nerve of my mentor to do that after everything I've done. Just needed to share this.",Anger
"To be honest, Every time I think about what happened, I get even more angry. Just needed to share this.",Anger
my teammate never listens and it drives me absolutely insane. I needed to get that off my chest.,Anger
The sheer nerve of my neighbor to do that after everything I've done. I'm still processing everything.,Anger
No one told me but My heart is full of joy after what happened with the meeting. It's just too much.,Happy
I need to vent — My anger is completely justified given what my father did.,Anger
I am sad.,Sad
I always knew that Why does my friend always find a way to ruin everything? Just needed to share this.,Anger
"To be honest, Today was such a wonderful day, everything went perfectly. I'm still processing everything.",Happy
"I have to say, I feel like I'm drowning in sorrow and can't find the surface. I'll figure it out.",Sad
I feel so empty and hollow inside after what happened. I'll figure it out.,Sad
"Honestly, The world feels grey and meaningless since the proposal. It's just too much.",Sad
"Looking back, Getting the exam was a dream come true, I'm overjoyed. I'll figure it out.",Happy
"Somehow, Some days the sadness is so heavy it's hard to breathe.",Sad
I am fantastically happy.,Happy
I am intensely angry.,Anger
"Looking back, Things at the trip have been going pretty smoothly lately.",Normal
"Right now, I'm so happy I feel like I could burst, this is incredible! I'm still processing everything.",Happy
"Honestly, How dare my father treat me this way, I'm beyond angry. I don't know what to do.",Anger
"Somehow, I prepared a simple meal and watched some television. It is what it is.",Normal
I feel very down.,Sad
I can't stand how my sister always acts so absurd. I'm still processing everything.,Anger
I need to vent — Every single day it's the same unacceptable behavior from my supervisor. It's just too much.,Anger
"Honestly, Nothing out of the ordinary happened today, just regular tasks. It is what it is.",Normal
"I have to say, she made me laugh so hard today, I love spending time together. It is what it is.",Happy
I always knew that I talked briefly with my coworker about the upcoming plans. I'm still processing everything.,Normal
"Looking back, I am absolutely seething at what my mentor just did. And that's just how it is.",Anger
I woke up at my usual time and started the day normally. I don't know what to do.,Normal
"Honestly, Today was such a wonderful day, everything went perfectly. Life goes on, I suppose.",Happy
I am not lonely.,Normal
"To be honest, Today marks the happiest day of my life because of school. And that's just how it is.",Happy
I need to vent — I keep grinning to myself thinking about how well the decision went. And that's just how it is.,Happy
"Honestly, I've had enough of my coworker disrespecting me every single day. I'll figure it out.",Anger
"Somehow, I wish I could turn back time and prevent the decision from happening. Just needed to share this.",Sad
Today marks the happiest day of my life because of the deadline. I don't know what to do.,Happy
I can't forgive my mother for what they did to school. I needed to get that off my chest.,Anger
Why do I feel so great?,Happy
"Honestly, my colleague really crossed the line this time, I'm livid. I'll figure it out.",Anger
I always knew that This whole the process is a disaster and I'm absolutely fuming. Just needed to share this.,Anger
"Right now, I feel so lucky to experience this kind of happiness right now. It's just too much.",Happy
I just realized I grabbed lunch and worked through some pending items.,Normal
"Somehow, she never listens and it drives me absolutely insane.",Anger
I'm not feeling fine.,Sad
I am feeling pretty normal.,Normal
I just realized Thinking about the decision fills me with an indescribable sadness. I needed to get that off my chest.,Sad
"To be honest, I checked in with my teacher and everything seems to be in order.",Normal
"To be honest, Today marks the happiest day of my life because of the project. Just needed to share this.",Happy
"Honestly, I talked briefly with my supervisor about the upcoming plans. I needed to get that off my chest.",Normal
I am irritated beyond belief.,Anger
"Thinking about it now, I wish I could turn back time and prevent the situation from happening. I needed to get that off my chest.",Sad
Why do I feel so great?,Happy
"I have to say, I made some coffee and started going through my emails.",Normal
I feel okay today.,Normal
"Somehow, There wasn't much happening today, just the usual routine.",Normal
No one told me but I reminded they about the appointment scheduled for Friday. I don't know what to do.,Normal
"Looking back, This is absolutely disgraceful, I'm so furious right now.",Anger
"No one told me but How dare my teacher treat me this way, I'm beyond angry. I don't know what to do.",Anger
"I have to say, I yelled because I couldn't contain my frustration anymore. I don't know what to do.",Anger
I am in a good mood.,Happy
"I have to say, I threw the papers across the room when I heard the news. I'll figure it out.",Anger
I always knew that Nothing feels the same since the situation occurred.,Sad
"To be honest, The sheer nerve of my teacher to do that after everything I've done. I'll figure it out.",Anger
"To be honest, my boss surprised me today and I couldn't stop smiling all day.",Happy
"To be honest, How dare the manager treat me this way, I'm beyond angry.",Anger
"Right now, my partner sent a routine update and I acknowledged it. I'll figure it out.",Normal
I'm losing my temper.,Anger
"Thinking about it now, The way my roommate handled the game was completely unacceptable. Just needed to share this.",Anger
I am not devastated.,Normal
I am furious.,Anger
"Stop it, I'm angry.",Anger
"At this point, my teacher mentioned they might drop by later this week. Just needed to share this.",Normal
