text,emotion
"I have to say, Nothing out of the ordinary happened today, just regular tasks.",Normal
"Thinking about it now, I miss the way things used to be before all of this happened. I'm still processing everything.",Sad
Waking up this morning I felt pure joy for the first time in ages. It is what it is.,Happy
The way my friend handled the office was completely unacceptable. It is what it is.,Anger
I'm not feeling angry.,Normal
I always knew that I can't forgive my brother for what they did to the deadline. And that's just how it is.,Anger
I need to vent — Everything reminds me of my teammate and the pain comes flooding back. I needed to get that off my chest.,Sad
I am truly happy.,Happy
I laughed until my stomach hurt with he today. It is what it is.,Happy
"I always knew that My heart aches deeply and I don't know how to stop the pain. Life goes on, I suppose.",Sad
"Thinking about it now, I yelled because I couldn't contain my frustration anymore. I'm still processing everything.",Anger
"I always knew that I prepared a simple meal and watched some television. Life goes on, I suppose.",Normal
"At this point, I don't feel like eating or talking to anyone right now. Life goes on, I suppose.",Sad
"Thinking about it now, I woke up at my usual time and started the day normally. Just needed to share this.",Normal
"Somehow, I'm not overreacting, my mother genuinely behaved maddening. Just needed to share this.",Anger
"Thinking about it now, I keep grinning to myself thinking about how well the game went. Just needed to share this.",Happy
"Somehow, she is no longer here and I miss them so much.",Sad
"At this point, The joy I feel from the results is something I'll never forget.",Happy
No one told me but Thinking about the presentation fills me with an indescribable sadness. I don't know what to do.,Sad
"Honestly, I can't believe my friend did that to me, it's completely outrageous! And that's just how it is.",Anger
I am beyond frustrated.,Anger
Why do I feel so empty?,Sad
"Right now, Life feels so beautiful and full of possibilities right now. I'm still processing everything.",Happy
"I have to say, I feel so lucky to experience this kind of happiness right now. And that's just how it is.",Happy
"Right now, The smile on my face hasn't faded since the results happened. I'm still processing everything.",Happy
I am genuinely okay.,Normal
I am not angry.,Normal
I am joyful.,Happy
"Looking back, The smile on my face hasn't faded since the game happened. I don't know what to do.",Happy
I need to vent — I want to bottle this feeling and keep it with me forever. I'm still processing everything.,Happy
Thinking about the proposal fills me with an indescribable sadness. It is what it is.,Sad
Some days the sadness is so heavy it's hard to breathe. I'm still processing everything.,Sad
I am entirely alright.,Normal
I am perfectly stable.,Normal
I am stable.,Normal
The loneliness after the presentation is something I wasn't prepared for. I'm still processing everything.,Sad
"Looking back, I reviewed some documents and provided my standard feedback. I don't know what to do.",Normal
"I need to vent — my neighbor really crossed the line this time, I'm livid.",Anger
I need to vent — I made some coffee and started going through my emails. I'm still processing everything.,Normal
I feel neutral.,Normal
"Somehow, I'm not overreacting, my colleague genuinely behaved outrageous. Just needed to share this.",Anger
I feel like a part of me died when the competition happened. It is what it is.,Sad
I need to vent — I don't feel like eating or talking to anyone right now. I don't know what to do.,Sad
I always knew that Things at the project have been going pretty smoothly lately. It's just too much.,Normal
I feel so alone.,Sad
I always knew that my teacher is no longer here and I miss them so much. And that's just how it is.,Sad
No one told me but I've been grieving this loss for weeks and it hasn't gotten easier.,Sad
I always knew that I cried myself to sleep again last night because of work. And that's just how it is.,Sad
I can't forgive my colleague for what they did to the conference. And that's just how it is.,Anger
I am so unhappy.,Sad
I am doing fine.,Normal
I can barely smile.,Sad
"Honestly, I feel utterly alone and abandoned by everyone around me. Just needed to share this.",Sad
I am glowing.,Happy
I need to vent — Every little thing today felt magical and full of possibility. And that's just how it is.,Happy
"Looking back, Life feels so beautiful and full of possibilities right now. I'll figure it out.",Happy
"Right now, The sheer nerve of my teacher to do that after everything I've done. Just needed to share this.",Anger
No one told me but the doctor sent a routine update and I acknowledged it. And that's just how it is.,Normal
"I always knew that I read a book for a bit before going to bed last night. Life goes on, I suppose.",Normal
"I have to say, I keep grinning to myself thinking about how well the competition went.",Happy
"I have to say, I feel utterly alone and abandoned by everyone around me. It's just too much.",Sad
The day was uneventful but productive enough overall. And that's just how it is.,Normal
"Honestly, I'm so angry I can barely think straight right now. I'll figure it out.",Anger
I feel ordinary.,Normal
"I made a list of things I need to get done this week. Life goes on, I suppose.",Normal
"Right now, I feel so grateful and blessed to have the manager in my life. I'm still processing everything.",Happy
I am feeling very angry today.,Anger
No one told me but I'm so angry I can barely think straight right now. It is what it is.,Anger
"I have to say, I reviewed some documents and provided my standard feedback.",Normal
"At this point, my friend told me they love me and I felt like I was floating. Life goes on, I suppose.",Happy
I am absolutely fine.,Normal
I need to vent — My patience has completely run out with this the competition.,Anger
The smile on my face hasn't faded since the interview happened. I don't know what to do.,Happy
I just realized I feel content and at peace with where my life is right now. I don't know what to do.,Happy
"Somehow, Today reminded me how much beauty there is in everyday moments. Life goes on, I suppose.",Happy
"Somehow, My heart is full of joy after what happened with the proposal. It is what it is.",Happy
I always knew that my teacher mentioned they might drop by later this week. I'm still processing everything.,Normal
I feel like I'm drowning in sorrow and can't find the surface. I don't know what to do.,Sad
I am fed up.,Anger
No one told me but I am absolutely seething at what he just did. It's just too much.,Anger
I always knew that I can't forgive my mother for what they did to the conference. And that's just how it is.,Anger
I always knew that I keep grinning to myself thinking about how well the situation went. And that's just how it is.,Happy
"Right now, Every little thing today felt magical and full of possibility. Just needed to share this.",Happy
No one told me but I read a book for a bit before going to bed last night. I'm still processing everything.,Normal
I'm so angry I can barely think straight right now. It is what it is.,Anger
"Looking back, she never listens and it drives me absolutely insane. It's just too much.",Anger
"Thinking about it now, I'm so mad I haven't been able to sleep thinking about the proposal. And that's just how it is.",Anger
I feel so empty and hollow inside after what happened. And that's just how it is.,Sad
"Thinking about it now, my partner made me laugh so hard today, I love spending time together. I'll figure it out.",Happy
I am not sad.,Normal
I always knew that Why does my friend always find a way to ruin everything? I'll figure it out.,Anger
I am bubbling with joy.,Happy
"Honestly, Every single day it's the same unacceptable behavior from my sister.",Anger
I am blue today.,Sad
"Right now, I yelled because I couldn't contain my frustration anymore. I'm still processing everything.",Anger
I am insanely mad.,Anger
I feel lost.,Sad
"I need to vent — I'm so happy I feel like I could burst, this is incredible!",Happy
I can't stand how my colleague always acts so disrespectful.,Anger
I am profoundly glad.,Happy
"Honestly, I'm so frustrated with the presentation, it makes my blood boil. I don't know what to do.",Anger
"Somehow, Losing my sister has left a hole in my heart that won't heal. Life goes on, I suppose.",Sad
I am perfectly stable.,Normal
"Looking back, My eyes are swollen from all the crying I've done this week. I'll figure it out.",Sad
I finished my work for the day and had some dinner. I'm still processing everything.,Normal
"Looking back, I feel like I'm drowning in sorrow and can't find the surface.",Sad
I am weeping.,Sad
"Looking back, The loneliness after the process is something I wasn't prepared for. And that's just how it is.",Sad
I am average today.,Normal
"Thinking about it now, Today was such a wonderful day, everything went perfectly. And that's just how it is.",Happy
"Right now, I'm so mad I haven't been able to sleep thinking about the results.",Anger
she called me this afternoon and we talked for a while. It's just too much.,Normal
"I have to say, Nothing out of the ordinary happened today, just regular tasks.",Normal
"To be honest, my colleague is no longer here and I miss them so much. I'm still processing everything.",Sad
I cried myself to sleep again last night because of school. It is what it is.,Sad
I need to vent — I feel so grateful and blessed to have my neighbor in my life.,Happy
"Right now, The joy I feel from the process is something I'll never forget. It is what it is.",Happy
I am not well.,Sad
I am not well.,Sad
I am not bad.,Normal
I need to vent — Seeing my roommate's belongings just makes the sadness worse.,Sad
I am outraged.,Anger
"My eyes are swollen from all the crying I've done this week. Life goes on, I suppose.",Sad
"Looking back, Everything reminds me of they and the pain comes flooding back. It is what it is.",Sad
I feel completely normal.,Normal
"Somehow, I don't feel like eating or talking to anyone right now. I'll figure it out.",Sad
"Looking back, The silence in the house since the interview is unbearable. I don't know what to do.",Sad
"I'm not overreacting, my friend genuinely behaved infuriating. It's just too much.",Anger
No one told me but my colleague sent a routine update and I acknowledged it. It is what it is.,Normal
"Right now, Seeing my neighbor's belongings just makes the sadness worse. It is what it is.",Sad
I just realized I went for a walk in the evening to clear my head a bit.,Normal
"I have to say, my father really crossed the line this time, I'm livid. It's just too much.",Anger
"Right now, I feel so empty and hollow inside after what happened. And that's just how it is.",Sad
I am ticked off.,Anger
I need to vent — Seeing she's belongings just makes the sadness worse. I needed to get that off my chest.,Sad
I always knew that Everything is falling into place and I couldn't be more grateful. I'm still processing everything.,Happy
"Thinking about it now, My anger is completely justified given what my mother did. I'm still processing everything.",Anger
"I have to say, I can't forgive my sister for what they did to the game.",Anger
I need to vent — I'm so angry I can barely think straight right now. I don't know what to do.,Anger
"Looking back, Nothing out of the ordinary happened today, just regular tasks. And that's just how it is.",Normal
"I always knew that I feel so alive and energized, everything feels right in the world. I'll figure it out.",Happy
"At this point, the meeting turned out even better than I ever imagined it would. I don't know what to do.",Happy
"Looking back, The grief I feel from the trip is overwhelming me.",Sad
I need to vent — I can't stand how my roommate always acts so selfish. It's just too much.,Anger
I just realized the doctor surprised me today and I couldn't stop smiling all day. I'm still processing everything.,Happy
I need to vent — Nothing feels the same since work occurred.,Sad
"At this point, I read a book for a bit before going to bed last night. It's just too much.",Normal
"Thinking about it now, I slammed the door so hard when my colleague said that ridiculous thing. It is what it is.",Anger
"Somehow, I've been grieving this loss for weeks and it hasn't gotten easier. And that's just how it is.",Sad
I feel awful.,Sad
I am supremely happy.,Happy
"Honestly, Some days the sadness is so heavy it's hard to breathe. I'm still processing everything.",Sad
"I have to say, I went to the store today to pick up a few things we needed. Life goes on, I suppose.",Normal
I am intensely joyful.,Happy
No one told me but I went for a walk in the evening to clear my head a bit.,Normal
"Right now, I woke up at my usual time and started the day normally.",Normal
I feel completely normal.,Normal
"At this point, Everything reminds me of my mother and the pain comes flooding back. I needed to get that off my chest.",Sad
I am not devastated.,Normal
I am coping okay.,Normal
"I just realized Every time I think about what happened, I get even more angry. I'll figure it out.",Anger
"Somehow, Today marks the happiest day of my life because of the interview. I'm still processing everything.",Happy
I need to vent — The unexpected kindness from my supervisor made my entire week. And that's just how it is.,Happy
"Right now, How dare my brother treat me this way, I'm beyond angry. I'm still processing everything.",Anger
"I have to say, My heart is full of joy after what happened with the presentation. And that's just how it is.",Happy
I feel so helpless.,Sad
"Ugh, I'm so angry!",Anger
I am so unhappy.,Sad
"Thinking about it now, I slammed the door so hard when my coworker said that ridiculous thing. I needed to get that off my chest.",Anger
"Thinking about it now, I keep grinning to myself thinking about how well the presentation went. And that's just how it is.",Happy
I am excited.,Happy
"Honestly, I keep grinning to myself thinking about how well the process went.",Happy
Every single day it's the same infuriating behavior from my teammate. And that's just how it is.,Anger
I feel wonderful.,Happy
No one told me but The day was uneventful but productive enough overall. And that's just how it is.,Normal
I always knew that I feel so lucky to experience this kind of happiness right now.,Happy
I slammed the door so hard when my partner said that ridiculous thing.,Anger
"At this point, The smile on my face hasn't faded since the interview happened. I'll figure it out.",Happy
"At this point, Everything reminds me of my sister and the pain comes flooding back. I don't know what to do.",Sad
I updated my schedule and moved a few tasks around.,Normal
I feel pure happiness.,Happy
I am coping okay.,Normal
No one told me but I grabbed lunch and worked through some pending items. I'll figure it out.,Normal
That was the most unacceptable thing my coworker could have ever done. I'm still processing everything.,Anger
"Looking back, The day was uneventful but productive enough overall.",Normal
"Thinking about it now, I feel so empty and hollow inside after what happened. Life goes on, I suppose.",Sad
I always knew that I checked in with my partner and everything seems to be in order. Just needed to share this.,Normal
I am overwhelmingly sad.,Sad
This is making me angry.,Anger
"I have to say, That was the most horrible thing the manager could have ever done. I don't know what to do.",Anger
I am terribly sad.,Sad
"Right now, The day ended without any major issues or surprises. Life goes on, I suppose.",Normal
"Looking back, The injustice of this work makes me want to scream. I'm still processing everything.",Anger
I am genuinely okay.,Normal
"Thinking about it now, This the deadline has pushed me past my breaking point. I'm still processing everything.",Anger
This is infuriating.,Anger
"Looking back, Getting the outcome was a dream come true, I'm overjoyed. Just needed to share this.",Happy
"Right now, Life feels so beautiful and full of possibilities right now.",Happy
I need to vent — my supervisor mentioned they might drop by later this week.,Normal
"Thinking about it now, I prepared a simple meal and watched some television.",Normal
No one told me but I prepared a simple meal and watched some television.,Normal
"Right now, my mentor really crossed the line this time, I'm livid. It is what it is.",Anger
I need to vent — We had a standard team meeting to go over the week's tasks. And that's just how it is.,Normal
"That meeting was a complete waste of time, I'm so irritated. Life goes on, I suppose.",Anger
I feel so good today.,Happy
"At this point, Some days the sadness is so heavy it's hard to breathe. Just needed to share this.",Sad
I always knew that The loneliness after school is something I wasn't prepared for. Just needed to share this.,Sad
I woke up at my usual time and started the day normally. I needed to get that off my chest.,Normal
"I just realized I can't believe my sister did that to me, it's completely maddening! Life goes on, I suppose.",Anger
"To be honest, I feel so grateful and blessed to have my roommate in my life. Life goes on, I suppose.",Happy
"I always knew that Today was such a wonderful day, everything went perfectly. I'll figure it out.",Happy
Why do I feel so joyful?,Happy
I am totally normal.,Normal
I am not happy.,Sad
I am very angry.,Anger
"Thinking about it now, I can't stand how they always acts so selfish. I'm still processing everything.",Anger
"Right now, my teammate is no longer here and I miss them so much. It is what it is.",Sad
I made a list of things I need to get done this week. And that's just how it is.,Normal
"Right now, I went to the store today to pick up a few things we needed. It's just too much.",Normal
I need to vent — I talked briefly with my colleague about the upcoming plans. Just needed to share this.,Normal
The commute was about the same as usual today. I don't know what to do.,Normal
"Somehow, I'm so happy I feel like I could burst, this is incredible! I'll figure it out.",Happy
I am alright.,Normal
I need to vent — Seeing my coworker's belongings just makes the sadness worse. It is what it is.,Sad
I reviewed some documents and provided my standard feedback. I don't know what to do.,Normal
Why does my friend always find a way to ruin everything?,Anger
I feel ordinary.,Normal
"I have to say, I got the the results I've been working towards and I'm ecstatic! I needed to get that off my chest.",Happy
I got the the outcome I've been working towards and I'm ecstatic! Just needed to share this.,Happy
The loneliness after the presentation is something I wasn't prepared for.,Sad
"I need to vent — Every time I think about what happened, I get even more angry. I needed to get that off my chest.",Anger
I need to vent — my friend surprised me today and I couldn't stop smiling all day. I needed to get that off my chest.,Happy
I always knew that I laughed until my stomach hurt with my mentor today.,Happy
"At this point, The loneliness after the competition is something I wasn't prepared for. Just needed to share this.",Sad
"The weather was pretty average today, not too hot or cold. Life goes on, I suppose.",Normal
"Looking back, I feel so lucky to experience this kind of happiness right now. I'll figure it out.",Happy
"At this point, I made a list of things I need to get done this week. I'm still processing everything.",Normal
"At this point, The way my teammate handled the results was completely unacceptable. I needed to get that off my chest.",Anger
"At this point, my mentor sent a routine update and I acknowledged it. I'm still processing everything.",Normal
I am livid.,Anger
"Honestly, I talked briefly with she about the upcoming plans. It is what it is.",Normal
I made a list of things I need to get done this week.,Normal
No one told me but I've been crying all day thinking about the project. I don't know what to do.,Sad
I am not unhappy.,Happy
I feel like I'm drowning in sorrow and can't find the surface. It is what it is.,Sad
"Somehow, I finished my work for the day and had some dinner.",Normal
I need to vent — I cried myself to sleep again last night because of the results.,Sad
I am entirely alright.,Normal
"To be honest, I feel content and at peace with where my life is right now. I'm still processing everything.",Happy
I am not sad.,Normal
The commute was about the same as usual today. I don't know what to do.,Normal
"To be honest, Seeing my supervisor's belongings just makes the sadness worse.",Sad
I need to vent — I hugged my roommate tight and felt so much love and warmth. I needed to get that off my chest.,Happy
Some days the sadness is so heavy it's hard to breathe. It is what it is.,Sad
I yelled because I couldn't contain my frustration anymore. I needed to get that off my chest.,Anger
"At this point, Nothing out of the ordinary happened today, just regular tasks.",Normal
I need to vent — My anger is completely justified given what my teacher did.,Anger
The silence in the house since the exam is unbearable. I don't know what to do.,Sad
"Looking back, I'm so frustrated with the conference, it makes my blood boil. I'm still processing everything.",Anger
"Somehow, I can't forgive she for what they did to the project.",Anger
I always knew that my father is no longer here and I miss them so much.,Sad
I confronted the doctor about this because enough is enough. I don't know what to do.,Anger
"Honestly, I just sat in the dark, too sad to move or do anything. It is what it is.",Sad
I need to vent — The injustice of this work makes me want to scream. It's just too much.,Anger
I don't feel great.,Sad
I am so happy!,Happy
"Looking back, I feel so alive and energized, everything feels right in the world. Just needed to share this.",Happy
"No one told me but Getting the competition was a dream come true, I'm overjoyed. I'm still processing everything.",Happy
I need to vent — the doctor never listens and it drives me absolutely insane. It is what it is.,Anger
"At this point, I'm so angry I can barely think straight right now.",Anger
I feel awful.,Sad
I am calm.,Normal
I don't feel happy.,Sad
I reminded the doctor about the appointment scheduled for Friday. And that's just how it is.,Normal
I feel moderate.,Normal
The afternoon was quiet and I got some reading done. And that's just how it is.,Normal
Why does everything feel hopeless?,Sad
I am super happy.,Happy
"Somehow, The day ended without any major issues or surprises. I'm still processing everything.",Normal
"To be honest, Today reminded me how much beauty there is in everyday moments. Life goes on, I suppose.",Happy
"I need to vent — Getting the process was a dream come true, I'm overjoyed.",Happy
"Honestly, my partner never listens and it drives me absolutely insane.",Anger
"I need to vent — I wish I could turn back time and prevent the decision from happening. Life goes on, I suppose.",Sad
I just realized The commute was about the same as usual today.,Normal
I am okay.,Normal
I can't stop crying.,Sad
I always knew that I keep reaching for my phone to call the doctor and then remember. It is what it is.,Sad
No one told me but The silence in the house since the office is unbearable.,Sad
"I have to say, I keep grinning to myself thinking about how well work went. And that's just how it is.",Happy
I am just being.,Normal
I feel numb.,Sad
"I have to say, My patience has completely run out with this school.",Anger
I hugged my mother tight and felt so much love and warmth. It is what it is.,Happy
"To be honest, Things at the event have been going pretty smoothly lately. It is what it is.",Normal
"Somehow, I can't believe my father did that to me, it's completely maddening! It is what it is.",Anger
I am genuinely okay.,Normal
I am catastrophically sad.,Sad
I need to vent — The way my teammate handled the presentation was completely unacceptable. It is what it is.,Anger
"At this point, I updated my schedule and moved a few tasks around. Just needed to share this.",Normal
I always knew that Waking up this morning I felt pure joy for the first time in ages. And that's just how it is.,Happy
the proposal turned out even better than I ever imagined it would. I don't know what to do.,Happy
"Thinking about it now, I miss the way things used to be before all of this happened. It's just too much.",Sad
"To be honest, The weather was pretty average today, not too hot or cold. It is what it is.",Normal
No one told me but The day ended without any major issues or surprises. I don't know what to do.,Normal
"I'm so frustrated with the situation, it makes my blood boil. I don't know what to do.",Anger
"Looking back, I'm absolutely thrilled about the situation, it's the best news ever! I needed to get that off my chest.",Happy
Every little thing today felt magical and full of possibility. It's just too much.,Happy
I feel unremarkable.,Normal
I am blue today.,Sad
"Somehow, I read a book for a bit before going to bed last night.",Normal
I am not sad.,Happy
"I have to say, I read a book for a bit before going to bed last night. I needed to get that off my chest.",Normal
I am totally normal.,Normal
I am mad right now.,Anger
"I have to say, Today reminded me how much beauty there is in everyday moments.",Happy
I have never been this angry.,Anger
I am thoroughly sad.,Sad
"Right now, Today reminded me how much beauty there is in everyday moments. I don't know what to do.",Happy
"At this point, I cried myself to sleep again last night because of the outcome. I'll figure it out.",Sad
