text,emotion
No one told me but Some days the sadness is so heavy it's hard to breathe.,Sad
"At this point, the doctor really crossed the line this time, I'm livid. I needed to get that off my chest.",Anger
"To be honest, My eyes are swollen from all the crying I've done this week.",Sad
I am incredibly sad.,Sad
"I need to vent — I'm so happy I feel like I could burst, this is incredible! It's just too much.",Happy
"To be honest, My heart is full of joy after what happened with the game. And that's just how it is.",Happy
I am deeply furious.,Anger
I just realized My patience has completely run out with this the decision.,Anger
"Somehow, I feel hopeless and don't know how things will ever get better. Life goes on, I suppose.",Sad
"I have to say, I've been crying all day thinking about the process. I needed to get that off my chest.",Sad
I feel fantastic.,Happy
"Honestly, I read a book for a bit before going to bed last night. It's just too much.",Normal
"I need to vent — I just sat in the dark, too sad to move or do anything. It is what it is.",Sad
I confronted my coworker about this because enough is enough.,Anger
Every single day it's the same unfair behavior from my brother. It's just too much.,Anger
I just realized my colleague is no longer here and I miss them so much. And that's just how it is.,Sad
"Right now, I shared the good news with my supervisor and we celebrated together. It is what it is.",Happy
"Getting the trip was a dream come true, I'm overjoyed.",Happy
I need to vent — I feel so empty and hollow inside after what happened. Just needed to share this.,Sad
"That meeting was a complete waste of time, I'm so irritated. It's just too much.",Anger
I am overjoyed.,Happy
"To be honest, Everything reminds me of my supervisor and the pain comes flooding back.",Sad
I always knew that My anger is completely justified given what my brother did. Just needed to share this.,Anger
Why does my teammate always find a way to ruin everything?,Anger
I am uncontrollably angry.,Anger
The day ended without any major issues or surprises. It's just too much.,Normal
"Right now, I woke up at my usual time and started the day normally. It's just too much.",Normal
I am tearful.,Sad
"At this point, my colleague surprised me today and I couldn't stop smiling all day.",Happy
I always knew that I stared at old photos of my teacher and just wept.,Sad
I can barely smile.,Sad
"Honestly, the manager left without saying goodbye and it broke me. I needed to get that off my chest.",Sad
"I have to say, The injustice of this the outcome makes me want to scream. I don't know what to do.",Anger
"Honestly, I woke up at my usual time and started the day normally. It is what it is.",Normal
Every little thing today felt magical and full of possibility. I don't know what to do.,Happy
I am not laughing.,Sad
"At this point, This the situation has pushed me past my breaking point.",Anger
"At this point, I feel utterly alone and abandoned by everyone around me. I needed to get that off my chest.",Sad
"Honestly, My anger is completely justified given what my colleague did. I'll figure it out.",Anger
"Thinking about it now, I feel hopeless and don't know how things will ever get better.",Sad
"I have to say, The project at the exam is moving along at a steady pace. Just needed to share this.",Normal
I feel bliss.,Happy
I am just fine.,Normal
"At this point, Every little thing today felt magical and full of possibility. I needed to get that off my chest.",Happy
I just realized I miss the way things used to be before all of this happened.,Sad
I am not okay.,Anger
"Somehow, I prepared a simple meal and watched some television. I'll figure it out.",Normal
"Every single day it's the same irresponsible behavior from my supervisor. Life goes on, I suppose.",Anger
"Somehow, My heart aches deeply and I don't know how to stop the pain. It's just too much.",Sad
I am not furious.,Normal
my teammate was my whole world and now I don't know who I am.,Sad
"Honestly, I keep grinning to myself thinking about how well work went. I don't know what to do.",Happy
Life feels so beautiful and full of possibilities right now.,Happy
"To be honest, My heart aches deeply and I don't know how to stop the pain. Life goes on, I suppose.",Sad
"To be honest, The joy I feel from the competition is something I'll never forget. Just needed to share this.",Happy
"At this point, I feel utterly alone and abandoned by everyone around me. I don't know what to do.",Sad
I just realized The way my teacher handled the competition was completely unacceptable.,Anger
I am as usual.,Normal
I always knew that they called me this afternoon and we talked for a while.,Normal
"I have to say, The joy I feel from the decision is something I'll never forget.",Happy
"No one told me but I'm so happy I feel like I could burst, this is incredible!",Happy
I am not very happy.,Normal
I am mourning.,Sad
I always knew that my roommate is no longer here and I miss them so much.,Sad
"Honestly, I feel so alive and energized, everything feels right in the world. Life goes on, I suppose.",Happy
"Thinking about it now, I went for a walk in the evening to clear my head a bit.",Normal
I keep reaching for my phone to call my boss and then remember. I don't know what to do.,Sad
"Getting the outcome was a dream come true, I'm overjoyed.",Happy
"Honestly, Losing my colleague has left a hole in my heart that won't heal. And that's just how it is.",Sad
I can't forgive my mother for what they did to the meeting. And that's just how it is.,Anger
We had a standard team meeting to go over the week's tasks. I don't know what to do.,Normal
"my partner made me laugh so hard today, I love spending time together. I'll figure it out.",Happy
I need to vent — The way my mentor handled the trip was completely unacceptable. I'll figure it out.,Anger
I need to vent — I updated my schedule and moved a few tasks around.,Normal
"Looking back, I don't feel like eating or talking to anyone right now. I'll figure it out.",Sad
Things at the results have been going pretty smoothly lately.,Normal
No one told me but Today marks the happiest day of my life because of the process. Just needed to share this.,Happy
"Somehow, my mother sent a routine update and I acknowledged it. I'm still processing everything.",Normal
I went for a walk in the evening to clear my head a bit. I needed to get that off my chest.,Normal
I need to vent — I grabbed lunch and worked through some pending items. I'll figure it out.,Normal
The commute was about the same as usual today. And that's just how it is.,Normal
I am fuming.,Anger
I always knew that Thinking about the project fills me with an indescribable sadness.,Sad
"I have to say, I talked briefly with my neighbor about the upcoming plans.",Normal
"I am angry, not sad.",Anger
I just realized We had a standard team meeting to go over the week's tasks.,Normal
"I have to say, I'm so angry I can barely think straight right now. It's just too much.",Anger
I am feeling very angry today.,Anger
I am feeling plain today.,Normal
I am mad right now.,Anger
"I always knew that I feel so alive and energized, everything feels right in the world. I'm still processing everything.",Happy
"To be honest, I feel so lucky to experience this kind of happiness right now. Just needed to share this.",Happy
"To be honest, I feel like I'm drowning in sorrow and can't find the surface. It is what it is.",Sad
"I have to say, I shared the good news with my mother and we celebrated together. I don't know what to do.",Happy
I need to vent — Some days the sadness is so heavy it's hard to breathe. And that's just how it is.,Sad
I am just fine.,Normal
I always knew that I can't forgive my roommate for what they did to the situation. And that's just how it is.,Anger
Why can't I stop crying?,Sad
I just realized I feel like a part of me died when the deadline happened. It's just too much.,Sad
"Somehow, Thinking about the project fills me with an indescribable sadness. I'll figure it out.",Sad
"Somehow, The day was uneventful but productive enough overall. I don't know what to do.",Normal
I am profoundly sad.,Sad
I am in a great mood.,Happy
I talked briefly with she about the upcoming plans.,Normal
"Honestly, The injustice of this the outcome makes me want to scream.",Anger
my brother never listens and it drives me absolutely insane. And that's just how it is.,Anger
No one told me but I wish I could turn back time and prevent the process from happening. I'll figure it out.,Sad
I made a list of things I need to get done this week.,Normal
"To be honest, My patience has completely run out with this the game. It is what it is.",Anger
"Somehow, The sheer nerve of she to do that after everything I've done. Just needed to share this.",Anger
I feel worthless.,Sad
I always knew that I miss the way things used to be before all of this happened. I'll figure it out.,Sad
"Somehow, The smile on my face hasn't faded since the results happened. Life goes on, I suppose.",Happy
"Somehow, I replied to some messages and scheduled a few meetings. Just needed to share this.",Normal
"Right now, I feel so alive and energized, everything feels right in the world. I needed to get that off my chest.",Happy
"Looking back, I checked in with my teammate and everything seems to be in order. I don't know what to do.",Normal
"I have to say, I grabbed lunch and worked through some pending items. It's just too much.",Normal
I am perfectly stable.,Normal
"Honestly, I made some coffee and started going through my emails. I needed to get that off my chest.",Normal
I've been grieving this loss for weeks and it hasn't gotten easier. I'll figure it out.,Sad
I can barely smile.,Sad
"Somehow, I made a list of things I need to get done this week. I'm still processing everything.",Normal
"I have to say, I'm so happy I feel like I could burst, this is incredible! It is what it is.",Happy
I just realized my father left without saying goodbye and it broke me. I don't know what to do.,Sad
"Honestly, I feel like I'm drowning in sorrow and can't find the surface. Life goes on, I suppose.",Sad
"I'm done tolerating this kind of behavior from they. Life goes on, I suppose.",Anger
I cannot calm down.,Anger
"I have to say, The afternoon was quiet and I got some reading done.",Normal
I am delighted.,Happy
"Looking back, The day ended without any major issues or surprises. I'll figure it out.",Normal
"To be honest, This whole the deadline is a disaster and I'm absolutely fuming. Life goes on, I suppose.",Anger
I always knew that my supervisor surprised me today and I couldn't stop smiling all day.,Happy
I always knew that my sister was my whole world and now I don't know who I am.,Sad
I am completely devastated.,Sad
"Thinking about it now, I feel utterly alone and abandoned by everyone around me.",Sad
"Thinking about it now, I can't stop the tears whenever I think about the interview. Just needed to share this.",Sad
"Honestly, I've had enough of my coworker disrespecting me every single day. I'm still processing everything.",Anger
"I just realized Nothing out of the ordinary happened today, just regular tasks.",Normal
"At this point, Some days the sadness is so heavy it's hard to breathe.",Sad
"At this point, I read a book for a bit before going to bed last night. I needed to get that off my chest.",Normal
I need to vent — I can't stand how my colleague always acts so thoughtless. I needed to get that off my chest.,Anger
"No one told me but Nothing out of the ordinary happened today, just regular tasks. I don't know what to do.",Normal
"Thinking about it now, I'm so angry I can barely think straight right now. Life goes on, I suppose.",Anger
"Thinking about it now, I grabbed lunch and worked through some pending items. I needed to get that off my chest.",Normal
I am not feeling strongly.,Normal
I am terribly sad.,Sad
My patience has completely run out with this the process. It's just too much.,Anger
I always knew that I'm beaming with pride over what I accomplished with the meeting. I'll figure it out.,Happy
I just realized I want to bottle this feeling and keep it with me forever. I'll figure it out.,Happy
I always knew that Why does they always find a way to ruin everything?,Anger
"The joy I feel from the outcome is something I'll never forget. Life goes on, I suppose.",Happy
I need to vent — Some days the sadness is so heavy it's hard to breathe. I'm still processing everything.,Sad
"Honestly, Getting the competition was a dream come true, I'm overjoyed. It's just too much.",Happy
"Looking back, I took the usual route to the deadline this morning. I needed to get that off my chest.",Normal
I need to vent — Every single day it's the same inconsiderate behavior from my supervisor. Just needed to share this.,Anger
"Right now, I keep reaching for my phone to call my friend and then remember. I'll figure it out.",Sad
This the outcome has pushed me past my breaking point. I'll figure it out.,Anger
I am deeply heartbroken.,Sad
I am tremendously happy.,Happy
"Seeing they's belongings just makes the sadness worse. Life goes on, I suppose.",Sad
I cannot calm down.,Anger
I slammed the door so hard when my teammate said that ridiculous thing.,Anger
"Honestly, The weather was pretty average today, not too hot or cold.",Normal
"Somehow, I read a book for a bit before going to bed last night. Just needed to share this.",Normal
"I need to vent — That meeting was a complete waste of time, I'm so irritated.",Anger
I am not joyful.,Sad
I am pissed off.,Anger
the trip turned out even better than I ever imagined it would.,Happy
"Thinking about it now, I've been grieving this loss for weeks and it hasn't gotten easier.",Sad
"To be honest, I can't stand how the manager always acts so outrageous. It is what it is.",Anger
"Thinking about it now, This is absolutely disgraceful, I'm so furious right now.",Anger
I am doing okay.,Normal
I always knew that I yelled because I couldn't contain my frustration anymore.,Anger
I feel wonderful.,Happy
"I just realized The silence in the house since work is unbearable. Life goes on, I suppose.",Sad
Why am I so happy today?,Happy
"Somehow, Every little thing today felt magical and full of possibility. It's just too much.",Happy
"Thinking about it now, I feel so empty and hollow inside after what happened. I'll figure it out.",Sad
"To be honest, Today reminded me how much beauty there is in everyday moments. And that's just how it is.",Happy
No one told me but I feel so grateful and blessed to have they in my life.,Happy
"At this point, The way my neighbor handled work was completely unacceptable.",Anger
"Looking back, That was the most terrible thing she could have ever done. I needed to get that off my chest.",Anger
I always knew that I yelled because I couldn't contain my frustration anymore. Just needed to share this.,Anger
"I feel so alive and energized, everything feels right in the world. I'm still processing everything.",Happy
I am very unhappy.,Sad
"I have to say, I feel so lucky to experience this kind of happiness right now. I'm still processing everything.",Happy
I am completely okay.,Normal
"To be honest, I feel content and at peace with where my life is right now. I don't know what to do.",Happy
I am thoroughly sad.,Sad
I feel neither sad nor happy.,Normal
"Looking back, Life feels so beautiful and full of possibilities right now. I'm still processing everything.",Happy
I am not furious.,Normal
"Somehow, I want to bottle this feeling and keep it with me forever. It's just too much.",Happy
No one told me but I feel like I'm drowning in sorrow and can't find the surface.,Sad
I am glowing.,Happy
I am so done.,Anger
"At this point, I feel utterly alone and abandoned by everyone around me.",Sad
"There wasn't much happening today, just the usual routine. I'm still processing everything.",Normal
I want to bottle this feeling and keep it with me forever. It is what it is.,Happy
I am devastated.,Sad
I just realized The way my brother handled the event was completely unacceptable.,Anger
I feel so empty and hollow inside after what happened. And that's just how it is.,Sad
"Looking back, My anger is completely justified given what my teacher did. Just needed to share this.",Anger
I feel okay today.,Normal
I am content.,Happy
"Looking back, I reviewed some documents and provided my standard feedback. I'm still processing everything.",Normal
"Thinking about it now, I took the usual route to the situation this morning. I needed to get that off my chest.",Normal
The grief I feel from work is overwhelming me. It's just too much.,Sad
I always knew that I reminded my teacher about the appointment scheduled for Friday.,Normal
I just realized I took the usual route to the decision this morning. I needed to get that off my chest.,Normal
"Looking back, This the game has pushed me past my breaking point.",Anger
I am laughing.,Happy
I am seething.,Anger
I need to vent — Every single day it's the same outrageous behavior from my supervisor. I needed to get that off my chest.,Anger
No one told me but I threw the papers across the room when I heard the news. Just needed to share this.,Anger
"Looking back, The injustice of this the office makes me want to scream. I'm still processing everything.",Anger
I always knew that I'm so angry I can barely think straight right now. I'm still processing everything.,Anger
"I just realized my roommate made me laugh so hard today, I love spending time together. I needed to get that off my chest.",Happy
"I have to say, my father sent a routine update and I acknowledged it. I'll figure it out.",Normal
I am entirely alright.,Normal
I am not alright.,Sad
I need to vent — I made a list of things I need to get done this week. Just needed to share this.,Normal
"At this point, Things at the project have been going pretty smoothly lately. It's just too much.",Normal
I am depressed.,Sad
"Thinking about it now, My heart is full of joy after what happened with the game. Life goes on, I suppose.",Happy
"I'm not overreacting, my teacher genuinely behaved horrible. I don't know what to do.",Anger
"At this point, The world feels grey and meaningless since the situation. Just needed to share this.",Sad
I'm done tolerating this kind of behavior from she. I needed to get that off my chest.,Anger
"I have to say, The loneliness after the results is something I wasn't prepared for. And that's just how it is.",Sad
"I have to say, The unexpected kindness from my teacher made my entire week. I'm still processing everything.",Happy
"I have to say, I made some coffee and started going through my emails. I'm still processing everything.",Normal
I feel normal.,Normal
I always knew that I prepared a simple meal and watched some television. It is what it is.,Normal
"To be honest, I just sat in the dark, too sad to move or do anything.",Sad
"Somehow, My heart aches deeply and I don't know how to stop the pain. I'll figure it out.",Sad
I am extremely happy.,Happy
I keep reaching for my phone to call my sister and then remember.,Sad
I feel incredible.,Happy
My heart is full of joy after what happened with work. Just needed to share this.,Happy
I am sad.,Sad
"To be honest, Today reminded me how much beauty there is in everyday moments. It's just too much.",Happy
"There wasn't much happening today, just the usual routine. I needed to get that off my chest.",Normal
I am not lonely.,Normal
"Right now, I'm so frustrated with school, it makes my blood boil. Just needed to share this.",Anger
"Honestly, I confronted he about this because enough is enough.",Anger
"I always knew that I'm so frustrated with the outcome, it makes my blood boil.",Anger
I am not upset.,Normal
"At this point, I went to the store today to pick up a few things we needed. I needed to get that off my chest.",Normal
Things at the trip have been going pretty smoothly lately. I needed to get that off my chest.,Normal
"Right now, Losing my mentor has left a hole in my heart that won't heal. And that's just how it is.",Sad
The way my brother handled the interview was completely unacceptable. I'll figure it out.,Anger
Everything is falling into place and I couldn't be more grateful. And that's just how it is.,Happy
I am terrifyingly angry.,Anger
I always knew that Nothing feels the same since the event occurred. I don't know what to do.,Sad
I am blue today.,Sad
I am average today.,Normal
I'm so angry I can barely think straight right now. It's just too much.,Anger
"Thinking about it now, my father left without saying goodbye and it broke me. And that's just how it is.",Sad
Not okay. I'm mad.,Anger
"At this point, Things at the exam have been going pretty smoothly lately. Just needed to share this.",Normal
"I have to say, I'm so happy I feel like I could burst, this is incredible!",Happy
"Looking back, My patience has completely run out with this the interview. It's just too much.",Anger
The loneliness after the results is something I wasn't prepared for. I needed to get that off my chest.,Sad
I need to vent — I can't forgive my teacher for what they did to the office. And that's just how it is.,Anger
"At this point, Today was such a wonderful day, everything went perfectly. Just needed to share this.",Happy
I am feeling so wonderful.,Happy
"Thinking about it now, I'm not overreacting, the doctor genuinely behaved infuriating. I don't know what to do.",Anger
"Honestly, The sheer nerve of my father to do that after everything I've done.",Anger
"Somehow, I checked in with my teacher and everything seems to be in order. I'll figure it out.",Normal
I am beyond frustrated.,Anger
I am hurting.,Sad
I am not very happy.,Normal
"At this point, Waking up this morning I felt pure joy for the first time in ages.",Happy
"Thinking about it now, The sheer nerve of my teacher to do that after everything I've done. I'll figure it out.",Anger
No one told me but Why does my father always find a way to ruin everything? Just needed to share this.,Anger
I always knew that Today marks the happiest day of my life because of the event. I'm still processing everything.,Happy
I always knew that my father sent a routine update and I acknowledged it. I'm still processing everything.,Normal
No one told me but I don't feel like eating or talking to anyone right now.,Sad
I talked briefly with my coworker about the upcoming plans. Just needed to share this.,Normal
"Thinking about it now, The unexpected kindness from my neighbor made my entire week.",Happy
"Somehow, I can't forgive my brother for what they did to the competition.",Anger
I feel awful.,Sad
I always knew that I don't feel like eating or talking to anyone right now. It is what it is.,Sad
"Thinking about it now, I feel like I'm drowning in sorrow and can't find the surface. I'm still processing everything.",Sad
"Right now, I just sat in the dark, too sad to move or do anything. It is what it is.",Sad
I am deeply heartbroken.,Sad
I am not angry at all.,Normal
my roommate surprised me today and I couldn't stop smiling all day.,Happy
"Looking back, Nothing out of the ordinary happened today, just regular tasks. Just needed to share this.",Normal
"Honestly, I shared the good news with he and we celebrated together. I'll figure it out.",Happy
I am beyond furious.,Anger
"I have to say, I'm so frustrated with the game, it makes my blood boil. I'm still processing everything.",Anger
"To be honest, I feel content and at peace with where my life is right now.",Happy
I just realized I made some coffee and started going through my emails. I needed to get that off my chest.,Normal
I am tearful.,Sad
I need to vent — I feel so lucky to experience this kind of happiness right now.,Happy
I am not unhappy.,Happy
I need to vent — The world feels grey and meaningless since the game. Just needed to share this.,Sad
I feel so grateful and blessed to have my roommate in my life. And that's just how it is.,Happy
I feel neutral.,Normal
"Honestly, The unexpected kindness from my father made my entire week. Just needed to share this.",Happy
"To be honest, I made some coffee and started going through my emails. I'll figure it out.",Normal
"Honestly, I laughed until my stomach hurt with the manager today. And that's just how it is.",Happy
I don't feel okay.,Sad
I need to vent — I spent the afternoon organizing some files on my computer. I'm still processing everything.,Normal
I am pissed off.,Anger
"Right now, my neighbor is no longer here and I miss them so much. I don't know what to do.",Sad
I slammed the door so hard when my boss said that ridiculous thing. It is what it is.,Anger
"Somehow, I finished my work for the day and had some dinner. I'll figure it out.",Normal
"To be honest, I'm beaming with pride over what I accomplished with the situation. I'll figure it out.",Happy
"To be honest, I've been grieving this loss for weeks and it hasn't gotten easier. I'll figure it out.",Sad
I got the the game I've been working towards and I'm ecstatic! Just needed to share this.,Happy
"I always knew that my sister made me laugh so hard today, I love spending time together. Life goes on, I suppose.",Happy
"Thinking about it now, The weather was pretty average today, not too hot or cold.",Normal
"Right now, I replied to some messages and scheduled a few meetings. I'm still processing everything.",Normal
I need to vent — My heart is full of joy after what happened with the event. Just needed to share this.,Happy
"I always knew that Every time I think about what happened, I get even more angry. I'll figure it out.",Anger
I am not ecstatic.,Normal
"Right now, I want to bottle this feeling and keep it with me forever. I needed to get that off my chest.",Happy
I am extremely angry.,Anger
